{
  "formatVersion": "1.0",
  "generator": {
    "product": "ZiWeiJS",
    "bibleVersion": "0.6.0",
    "engineVersion": "0.1.0",
    "schemaVersion": "2.0",
    "profile": "canonical"
  },
  "subject": {
    "sexForCalculation": "male"
  },
  "birth": {
    "calendarType": "solar",
    "birthTimePrecision": "exact"
  },
  "natal": {
    "lifePalace": "命宮",
    "lifePalaceBranch": "zi",
    "bodyPalace": "夫妻宮",
    "bodyPalaceBranch": "xu",
    "bureau": "huo6",
    "bureauName": "火六局",
    "masterStar": "ZW.STAR.MAJOR.TANLANG",
    "bodyStar": "ZW.STAR.AUX.HUOLING",
    "yinYang": "yang",
    "direction": "forward"
  },
  "palaces": [
    {
      "palaceId": "life",
      "name": "命宮",
      "stem": "戊",
      "branch": "zi",
      "isLifePalace": true,
      "isBodyPalace": false,
      "majorPeriod": {
        "fromAge": 6,
        "toAge": 15
      },
      "stars": [
        {
          "starId": "ZW.STAR.MAJOR.POJUN",
          "name": "破軍",
          "category": "major",
          "dignity": "miao",
          "transformations": [],
          "status": "canonical",
          "ruleId": "ZW.CALC.STAR.TIANFU_SERIES.001",
          "ruleVersion": "1.0"
        },
        {
          "starId": "ZW.STAR.AUX.TIANXING",
          "name": "天刑",
          "category": "minor",
          "transformations": [],
          "status": "canonical",
          "ruleId": "ZW.CALC.STAR.ZUOFU_YOUBI.001",
          "ruleVersion": "1.0"
        },
        {
          "starId": "ZW.STAR.AUX.TIANKU",
          "name": "天哭",
          "category": "minor",
          "transformations": [],
          "status": "canonical",
          "ruleId": "ZW.CALC.STAR.YEARBRANCH_AUX.001",
          "ruleVersion": "1.0"
        },
        {
          "starId": "ZW.STAR.AUX.XIAOHAO",
          "name": "小耗",
          "category": "minor",
          "transformations": [],
          "status": "canonical",
          "ruleId": "ZW.CALC.STAR.YEARBRANCH_AUX.001",
          "ruleVersion": "1.0"
        },
        {
          "starId": "ZW.STAR.AUX.TIANFU2",
          "name": "天福",
          "category": "minor",
          "transformations": [],
          "status": "candidate",
          "ruleId": "ZW.CALC.STAR.BYYEARSTEM2.001",
          "ruleVersion": "1.0"
        },
        {
          "starId": "ZW.STAR.AUX.ENGUANG",
          "name": "恩光",
          "category": "minor",
          "transformations": [],
          "status": "candidate",
          "ruleId": "ZW.CALC.STAR.BYDAYHOUR.001",
          "ruleVersion": "1.0"
        },
        {
          "starId": "ZW.STAR.AUX.ZHIFU",
          "name": "指背",
          "category": "minor",
          "transformations": [],
          "status": "candidate",
          "ruleId": "ZW.CALC.STAR.SPECIAL_AUX.001",
          "ruleVersion": "1.0"
        },
        {
          "starId": "ZW.STAR.PERIOD.DAHAO2",
          "name": "大耗",
          "category": "period",
          "transformations": [],
          "status": "candidate",
          "ruleId": "ZW.CALC.STAR.PERIOD12.001",
          "ruleVersion": "1.0"
        },
        {
          "starId": "ZW.STAR.INTERIM.ZAISHA",
          "name": "災煞",
          "category": "interim",
          "transformations": [],
          "status": "candidate",
          "ruleId": "ZW.CALC.STAR.PERIOD12.001",
          "ruleVersion": "1.0"
        }
      ],
      "changsheng": "tai",
      "boshi": "jiangjun"
    },
    {
      "palaceId": "siblings",
      "name": "兄弟宮",
      "stem": "丁",
      "branch": "hai",
      "isLifePalace": false,
      "isBodyPalace": false,
      "majorPeriod": {
        "fromAge": 116,
        "toAge": 125
      },
      "stars": [
        {
          "starId": "ZW.STAR.MAJOR.TAIYANG",
          "name": "太陽",
          "category": "major",
          "dignity": "xian",
          "transformations": [],
          "status": "canonical",
          "ruleId": "ZW.CALC.STAR.ZIWEI_SERIES.001",
          "ruleVersion": "1.0"
        },
        {
          "starId": "ZW.STAR.AUX.TIANGUAN",
          "name": "天官",
          "category": "minor",
          "transformations": [],
          "status": "candidate",
          "ruleId": "ZW.CALC.STAR.BYYEARSTEM2.001",
          "ruleVersion": "1.0"
        },
        {
          "starId": "ZW.STAR.AUX.BAZUO",
          "name": "八座",
          "category": "minor",
          "transformations": [],
          "status": "candidate",
          "ruleId": "ZW.CALC.STAR.BYDAY.001",
          "ruleVersion": "1.0"
        },
        {
          "starId": "ZW.STAR.PERIOD.XIAOHAO2",
          "name": "小耗",
          "category": "period",
          "transformations": [],
          "status": "candidate",
          "ruleId": "ZW.CALC.STAR.PERIOD12.001",
          "ruleVersion": "1.0"
        },
        {
          "starId": "ZW.STAR.INTERIM.JIESHA2",
          "name": "劫煞",
          "category": "interim",
          "transformations": [],
          "status": "candidate",
          "ruleId": "ZW.CALC.STAR.PERIOD12.001",
          "ruleVersion": "1.0"
        },
        {
          "starId": "ZW.STAR.AUX.TAIFU",
          "name": "台輔",
          "category": "aux",
          "transformations": [],
          "status": "canonical",
          "ruleId": "ZW.CALC.STAR.TAIFU_FENGGAO.001",
          "ruleVersion": "1.0"
        },
        {
          "starId": "ZW.STAR.AUX.TIANWU",
          "name": "天巫",
          "category": "aux",
          "transformations": [],
          "status": "canonical",
          "ruleId": "ZW.CALC.STAR.TIANWU.001",
          "ruleVersion": "1.0"
        }
      ],
      "changsheng": "jue",
      "boshi": "xiaohao"
    },
    {
      "palaceId": "spouse",
      "name": "夫妻宮",
      "stem": "丙",
      "branch": "xu",
      "isLifePalace": false,
      "isBodyPalace": true,
      "majorPeriod": {
        "fromAge": 106,
        "toAge": 115
      },
      "stars": [
        {
          "starId": "ZW.STAR.MAJOR.WUQU",
          "name": "武曲",
          "category": "major",
          "dignity": "li",
          "transformations": [],
          "status": "canonical",
          "ruleId": "ZW.CALC.STAR.ZIWEI_SERIES.001",
          "ruleVersion": "1.0"
        },
        {
          "starId": "ZW.STAR.AUX.HUAGAI",
          "name": "華蓋",
          "category": "minor",
          "transformations": [],
          "status": "canonical",
          "ruleId": "ZW.CALC.STAR.YEARBRANCH_AUX.001",
          "ruleVersion": "1.0"
        },
        {
          "starId": "ZW.STAR.AUX.XUNKONG",
          "name": "旬空",
          "category": "minor",
          "transformations": [],
          "status": "candidate",
          "ruleId": "ZW.CALC.STAR.SPECIAL_AUX.001",
          "ruleVersion": "1.0"
        },
        {
          "starId": "ZW.STAR.AUX.FEILIAN",
          "name": "蜚廉",
          "category": "minor",
          "transformations": [],
          "status": "candidate",
          "ruleId": "ZW.CALC.STAR.SPECIAL_AUX.001",
          "ruleVersion": "1.0"
        },
        {
          "starId": "ZW.STAR.PERIOD.GUANFU2",
          "name": "官符",
          "category": "period",
          "transformations": [],
          "status": "candidate",
          "ruleId": "ZW.CALC.STAR.PERIOD12.001",
          "ruleVersion": "1.0"
        },
        {
          "starId": "ZW.STAR.INTERIM.HUAGAI2",
          "name": "華蓋",
          "category": "interim",
          "transformations": [],
          "status": "candidate",
          "ruleId": "ZW.CALC.STAR.PERIOD12.001",
          "ruleVersion": "1.0"
        }
      ],
      "changsheng": "mu",
      "boshi": "qinglong"
    },
    {
      "palaceId": "children",
      "name": "子女宮",
      "stem": "乙",
      "branch": "you",
      "isLifePalace": false,
      "isBodyPalace": false,
      "majorPeriod": {
        "fromAge": 96,
        "toAge": 105
      },
      "stars": [
        {
          "starId": "ZW.STAR.MAJOR.TIANTONG",
          "name": "天同",
          "category": "major",
          "dignity": "ping",
          "transformations": [],
          "status": "canonical",
          "ruleId": "ZW.CALC.STAR.ZIWEI_SERIES.001",
          "ruleVersion": "1.0"
        },
        {
          "starId": "ZW.STAR.AUX.WENQU",
          "name": "文曲",
          "category": "aux",
          "transformations": [],
          "status": "canonical",
          "ruleId": "ZW.CALC.STAR.CHANGQU.001",
          "ruleVersion": "1.0"
        },
        {
          "starId": "ZW.STAR.MALEFIC.QINGYANG",
          "name": "擎羊",
          "category": "malefic",
          "transformations": [],
          "status": "canonical",
          "ruleId": "ZW.CALC.STAR.YEARSTEM_AUX.001",
          "ruleVersion": "1.0"
        },
        {
          "starId": "ZW.STAR.AUX.XIANCHI",
          "name": "咸池",
          "category": "minor",
          "transformations": [],
          "status": "canonical",
          "ruleId": "ZW.CALC.STAR.YEARBRANCH_AUX.001",
          "ruleVersion": "1.0"
        },
        {
          "starId": "ZW.STAR.AUX.HONGLUAN",
          "name": "紅鸞",
          "category": "minor",
          "transformations": [],
          "status": "canonical",
          "ruleId": "ZW.CALC.STAR.YEARBRANCH_AUX.001",
          "ruleVersion": "1.0"
        },
        {
          "starId": "ZW.STAR.AUX.SUISHEN",
          "name": "歲驛",
          "category": "minor",
          "transformations": [],
          "status": "canonical",
          "ruleId": "ZW.CALC.STAR.YEARBRANCH_AUX.001",
          "ruleVersion": "1.0"
        },
        {
          "starId": "ZW.STAR.AUX.TIANYUE2",
          "name": "天月",
          "category": "minor",
          "transformations": [],
          "status": "candidate",
          "ruleId": "ZW.CALC.STAR.SPECIAL_AUX.001",
          "ruleVersion": "1.0"
        },
        {
          "starId": "ZW.STAR.PERIOD.GUANSUO",
          "name": "貫索",
          "category": "period",
          "transformations": [],
          "status": "candidate",
          "ruleId": "ZW.CALC.STAR.PERIOD12.001",
          "ruleVersion": "1.0"